{
  "schema_version": "1.0",
  "source_of_truth": "docs_control/workflow_control_plane.json",
  "model": {
    "model_id": "workflow-control-plane",
    "model_version": "0.3.0",
    "status": "DRAFT",
    "scope_statement": "Canonical JSON SSOT for workflow/control-plane diagrams covering local hooks, verify fast runtime path, CI jobs, logging/evidence, and self-hosting diagram subsystem.",
    "determinism_contract": "Only this JSON is manually edited. Generated diagram views are stale-checked and must not be edited manually.",
    "created_at_utc": "2026-02-26T13:45:00Z",
    "updated_at_utc": "2026-02-28T16:55:00Z",
    "approved_at_utc": null,
    "approved_by": null,
    "freeze_rules": [
      "Workflow changes without SSOT update are P0 drift.",
      "Promotion to APPROVED requires alignment and stale-check implementation."
    ]
  },
  "coverage_requirements": {
    "full_process_required": true,
    "required_domains": [
      "update",
      "generate",
      "validate",
      "lint",
      "test",
      "log",
      "evidence",
      "traceability",
      "hooks",
      "ci",
      "docs_publish",
      "manual_review",
      "exceptions_non_blocking"
    ],
    "required_mechanisms": [
      "verify_fast_orchestrator",
      "verify_stage_steps",
      "capability_audit",
      "control_docs_generation",
      "stale_check",
      "verify_run_logging",
      "traceability_validation",
      "next_session_validation",
      "markdownlint_blocking",
      "markdownlint_backlog",
      "vale_blocking",
      "vale_backlog",
      "mkdocs_strict",
      "pre_commit_enforcement",
      "ci_enforcement"
    ],
    "required_paths": [
      "pass_path",
      "fail_fast_path",
      "non_blocking_backlog_path",
      "skip_optional_path"
    ],
    "required_artifact_ids": [
      "artifact.workflow_control_plane_json",
      "artifact.workflow_control_plane_schema",
      "artifact.verify_runs_json",
      "artifact.task_status_json",
      "artifact.capability_audit_json",
      "artifact.capability_audit_summary_json",
      "artifact.observed_verify_stage_manifest",
      "artifact.observed_ci_jobs_manifest",
      "artifact.observed_hooks_manifest",
      "artifact.workflow_control_plane_full_md"
    ],
    "required_node_ids": [
      "node.verify_fast_orchestrator",
      "node.validate_workflow_alignment",
      "node.validate_workflow_control_plane",
      "node.validate_workflow_control_alignment",
      "node.validate_capability_audit",
      "node.preflight_state_discovery",
      "node.verify_batch_status_claims",
      "node.validate_traceability",
      "node.validate_next_session",
      "node.enforce_next_session_flow",
      "node.generate_control_docs",
      "node.workflow_control_diagrams_generator",
      "node.workflow_control_diagrams_stale_check",
      "node.mkdocs_strict",
      "node.node_check_svelte",
      "node.rust_fmt_check",
      "node.rust_clippy",
      "node.log_verify_run"
    ]
  },
  "actors": [
    {
      "actor_id": "actor.user",
      "label": "User",
      "kind": "human",
      "domain_tags": ["update", "manual_review"],
      "order_index": 10
    },
    {
      "actor_id": "actor.local_tooling",
      "label": "Local Tooling",
      "kind": "local_tooling",
      "domain_tags": ["hooks", "validate", "lint", "test", "generate"],
      "order_index": 15
    },
    {
      "actor_id": "actor.ci",
      "label": "CI Runner",
      "kind": "ci_runner",
      "domain_tags": ["ci", "validate", "lint", "test", "docs_publish"],
      "order_index": 20
    }
  ],
  "artifacts": [
    {
      "artifact_id": "artifact.workflow_control_plane_json",
      "label": "Workflow Control Plane SSOT",
      "kind": "canonical_json",
      "path": "docs_control/workflow_control_plane.json",
      "canonicality": "canonical",
      "mutable_by": "manual",
      "domain_tags": ["generate", "validate", "manual_review"],
      "order_index": 10
    },
    {
      "artifact_id": "artifact.workflow_control_plane_schema",
      "label": "Workflow Control Plane Schema",
      "kind": "schema",
      "path": "docs_control/workflow_control_plane.schema.json",
      "canonicality": "canonical",
      "mutable_by": "manual",
      "domain_tags": ["validate"],
      "order_index": 20
    },
    {
      "artifact_id": "artifact.verify_runs_json",
      "label": "Verify Runs Evidence Log",
      "kind": "evidence",
      "path": "docs_control/verify_runs.json",
      "canonicality": "canonical",
      "mutable_by": "runtime_only",
      "domain_tags": ["log", "evidence"],
      "order_index": 30
    },
    {
      "artifact_id": "artifact.traceability_json",
      "label": "Traceability Registry",
      "kind": "canonical_json",
      "path": "docs_control/traceability.json",
      "canonicality": "canonical",
      "mutable_by": "manual",
      "domain_tags": ["traceability", "validate", "evidence"],
      "order_index": 40
    },
    {
      "artifact_id": "artifact.next_session_json",
      "label": "NEXT_SESSION Canonical JSON",
      "kind": "canonical_json",
      "path": "docs_control/next_session.json",
      "canonicality": "canonical",
      "mutable_by": "manual",
      "domain_tags": ["validate", "manual_review", "evidence"],
      "order_index": 50
    },
    {
      "artifact_id": "artifact.pre_commit_config",
      "label": "pre-commit Config",
      "kind": "hook_config",
      "path": ".pre-commit-config.yaml",
      "canonicality": "canonical",
      "mutable_by": "manual",
      "domain_tags": ["hooks", "lint", "validate"],
      "order_index": 60
    },
    {
      "artifact_id": "artifact.verify_stage_script",
      "label": "verify_stage Script",
      "kind": "code",
      "path": "scripts/verify_stage.ps1",
      "canonicality": "canonical",
      "mutable_by": "manual",
      "domain_tags": ["validate", "lint", "test", "log", "evidence"],
      "order_index": 70
    },
    {
      "artifact_id": "artifact.ci_workflow_ci",
      "label": "CI Workflow",
      "kind": "workflow_config",
      "path": ".github/workflows/ci.yml",
      "canonicality": "canonical",
      "mutable_by": "manual",
      "domain_tags": ["ci", "validate", "test"],
      "order_index": 80
    },
    {
      "artifact_id": "artifact.ci_workflow_quality_gate",
      "label": "Quality Gate Workflow",
      "kind": "workflow_config",
      "path": ".github/workflows/quality-gate.yml",
      "canonicality": "canonical",
      "mutable_by": "manual",
      "domain_tags": ["ci", "validate", "lint", "docs_publish"],
      "order_index": 90
    },
    {
      "artifact_id": "artifact.ci_workflow_determinism",
      "label": "Determinism Workflow",
      "kind": "workflow_config",
      "path": ".github/workflows/determinism.yml",
      "canonicality": "canonical",
      "mutable_by": "manual",
      "domain_tags": ["ci", "validate", "generate", "docs_publish"],
      "order_index": 92
    },
    {
      "artifact_id": "artifact.ci_workflow_clean_clone_smoke",
      "label": "Clean Clone Smoke Workflow",
      "kind": "workflow_config",
      "path": ".github/workflows/clean-clone-smoke.yml",
      "canonicality": "canonical",
      "mutable_by": "manual",
      "domain_tags": ["ci", "validate", "generate", "docs_publish"],
      "order_index": 93
    },
    {
      "artifact_id": "artifact.mkdocs_yml",
      "label": "MkDocs Config",
      "kind": "workflow_config",
      "path": "mkdocs.yml",
      "canonicality": "canonical",
      "mutable_by": "manual",
      "domain_tags": ["docs_publish", "validate"],
      "order_index": 95
    },
    {
      "artifact_id": "artifact.task_status_json",
      "label": "Task Status Registry",
      "kind": "canonical_json",
      "path": "docs_control/task_status.json",
      "canonicality": "canonical",
      "mutable_by": "manual",
      "domain_tags": ["validate", "evidence", "manual_review"],
      "order_index": 100
    },
    {
      "artifact_id": "artifact.capability_audit_json",
      "label": "Capability Audit Registry",
      "kind": "canonical_json",
      "path": "docs_control/capability_audit.json",
      "canonicality": "canonical",
      "mutable_by": "manual",
      "domain_tags": ["validate", "manual_review", "evidence"],
      "order_index": 105
    },
    {
      "artifact_id": "artifact.capability_audit_schema",
      "label": "Capability Audit Schema",
      "kind": "schema",
      "path": "docs_control/capability_audit.schema.json",
      "canonicality": "canonical",
      "mutable_by": "manual",
      "domain_tags": ["validate"],
      "order_index": 106
    },
    {
      "artifact_id": "artifact.generated_next_session_md",
      "label": "Generated NEXT_SESSION View",
      "kind": "generated_doc",
      "path": "docs/generated/control/NEXT_SESSION.md",
      "canonicality": "generated",
      "mutable_by": "generator_only",
      "domain_tags": ["generate", "docs_publish", "evidence"],
      "order_index": 110
    },
    {
      "artifact_id": "artifact.generated_traceability_md",
      "label": "Generated Traceability View",
      "kind": "generated_doc",
      "path": "docs/generated/control/TRACEABILITY_SUMMARY.md",
      "canonicality": "generated",
      "mutable_by": "generator_only",
      "domain_tags": ["generate", "docs_publish", "traceability"],
      "order_index": 120
    },
    {
      "artifact_id": "artifact.preflight_state_json",
      "label": "Preflight state snapshot",
      "kind": "log",
      "path": "logs/verify/preflight_state.json",
      "canonicality": "observed",
      "mutable_by": "runtime_only",
      "domain_tags": ["validate", "log", "evidence"],
      "order_index": 130
    },
    {
      "artifact_id": "artifact.batch_status_verify_summary_json",
      "label": "Batch status verify summary",
      "kind": "log",
      "path": "logs/verify/batch_status_verify_summary.json",
      "canonicality": "observed",
      "mutable_by": "runtime_only",
      "domain_tags": ["validate", "log", "evidence"],